{
  "schema_version": "1",
  "database": "npda-clinical",
  "title": "Northway PDU Diabetes Clinic EPR",
  "description": "Clinical EPR for the Northway Paediatric Diabetes Unit (PDU). Captures the longitudinal clinic record of children and young people under diabetes care: clinic_visits (one row per outpatient or inpatient encounter, with the clinician-recorded ethnicity and diabetes type), measurements (long-form height, weight, HbA1c, blood pressure, urinary ACR and cholesterol), screening_results (annual review care processes: foot, retinal, thyroid, coeliac, influenza), technology (insulin regimen and delivery method, non-insulin medication, CGM use, blood-ketone testing, immunotherapy receipt, thyroid treatment, lifestyle advice flag), psychology (annual psychological screening, mental-health appointment status, level-3 carbohydrate-counting education date, dietitian appointment) and clinical_notes (free-text clinic letters, admission letters and admission summaries). Joined to the demographics/registration system (npda-demographics) by NHS number (patient_ref). Some clinically important data is held only in free-text clinical_notes \u2014 notably Jacob Whitfield's HbA1c on his first audit-year visit (V0004), Daniel Chen's DKA admission pH and standard bicarbonate (N0009), Ethan Brookes' carb-counting education date and pH at diagnosis (N0003), and Imani Joseph's psychological-screening narrative and awaited retinal-screening result. One patient (Daniel Chen, V0024) has a missing HbA1c because the clinic machine was offline.",
  "identity_links": [
    {
      "column": "clinic_visits.patient_ref",
      "target": "npda-demographics -> patients.nhs_number",
      "evidence": "10/10 sampled values found in target"
    },
    {
      "column": "clinical_notes.patient_ref",
      "target": "npda-demographics -> patients.nhs_number",
      "evidence": "10/10 sampled values found in target"
    },
    {
      "column": "measurements.patient_ref",
      "target": "npda-demographics -> patients.nhs_number",
      "evidence": "10/10 sampled values found in target"
    },
    {
      "column": "psychology.patient_ref",
      "target": "npda-demographics -> patients.nhs_number",
      "evidence": "10/10 sampled values found in target"
    },
    {
      "column": "screening_results.patient_ref",
      "target": "npda-demographics -> patients.nhs_number",
      "evidence": "10/10 sampled values found in target"
    },
    {
      "column": "technology.patient_ref",
      "target": "npda-demographics -> patients.nhs_number",
      "evidence": "10/10 sampled values found in target"
    }
  ],
  "tables": [
    {
      "name": "clinic_visits",
      "description": "One row per clinic encounter \u2014 outpatient appointments, inpatient admissions (visit_type = 'inpatient') and the final transitional appointment for a patient transferring to adult diabetes care (visit_type = 'transition_final'). Carries the patient reference (NHS number), the recording clinician, and the ethnicity and diabetes type as recorded on the clinic system at that visit (these can differ from the registration-system codes \u2014 known for Sumaiya Begum / 9874123004 whose clinical-system ethnicity is 'L' but registration ethnicity is 'K').",
      "columns": [
        {
          "name": "visit_id",
          "type": "text",
          "description": "Identifier of the clinic visit (V0001-V0026).",
          "filterable": false,
          "reason": "identifier"
        },
        {
          "name": "patient_ref",
          "type": "text",
          "description": "NHS number of the patient \u2014 the join key to the demographics system (npda-demographics.patients.nhs_number).",
          "filterable": false,
          "reason": "identifier"
        },
        {
          "name": "visit_date",
          "type": "text",
          "description": "Date of the clinic visit (ISO yyyy-mm-dd).",
          "filterable": true,
          "filter_type": "date",
          "range": {
            "min": "2026-04-22",
            "max": "2027-01-20"
          }
        },
        {
          "name": "visit_type",
          "type": "text",
          "description": "Type of encounter: 'outpatient' for routine clinic, 'inpatient' for hospital admission, 'transition_final' for the last paediatric visit before transferring to adult diabetes services.",
          "filterable": true,
          "filter_type": "category",
          "values": [
            "inpatient",
            "outpatient",
            "transition_final"
          ],
          "codes": {
            "outpatient": "Outpatient clinic visit",
            "inpatient": "Inpatient hospital admission",
            "transition_final": "Final paediatric appointment before transition to adult service"
          }
        },
        {
          "name": "clinician",
          "type": "text",
          "description": "Clinician leading the visit (paediatric diabetologist or diabetes specialist nurse).",
          "filterable": true,
          "filter_type": "category",
          "values": [
            "DSN K Murray",
            "Dr P Edwards",
            "Dr R Singh"
          ]
        },
        {
          "name": "ethnicity_recorded",
          "type": "text",
          "description": "Ethnicity as recorded on the clinic EPR at this visit, using the NHS Data Dictionary letter codes (A, F, H, J, L, M, N, R). Note: this may differ from npda-demographics.patients.ethnicity_code for the same patient \u2014 for Sumaiya Begum the clinic system shows 'L' (Asian - Any other Asian background) while the registration system shows 'K' (Asian - Bangladeshi), creating a known cross-source conflict.",
          "filterable": true,
          "filter_type": "category",
          "values": [
            "A",
            "F",
            "H",
            "J",
            "L",
            "M",
            "N",
            "R"
          ]
        },
        {
          "name": "diabetes_type_recorded",
          "type": "text",
          "description": "Diabetes type code as recorded on the clinic EPR at this visit (NPDA permitted values).",
          "filterable": true,
          "filter_type": "category",
          "values": [
            "1",
            "2",
            "4"
          ],
          "codes": {
            "1": "Type 1 Diabetes Mellitus",
            "2": "Type 2 Diabetes Mellitus",
            "3": "Cystic Fibrosis Related Diabetes",
            "4": "MODY (monogenic forms of diabetes)",
            "5": "Other specified Diabetes Mellitus",
            "99": "Unknown/unspecified"
          }
        }
      ],
      "row_count": 26
    },
    {
      "name": "measurements",
      "description": "Long-form table of clinical measurements and laboratory results captured at clinic visits \u2014 one row per (visit, measurement_type) tuple. Measurement types observed in the cohort: height (cm), weight (kg), hba1c (mmol/mol or %), systolic_bp / diastolic_bp (mmHg), acr (urinary albumin:creatinine ratio in mg/mmol), cholesterol (mmol/l). Not every patient has every type recorded at every visit \u2014 see also clinical_notes for HbA1c measurements taken on capillary cartridges and recorded only in narrative (e.g. Jacob Whitfield V0004) and for the missing HbA1c at Daniel Chen's V0024 visit.",
      "columns": [
        {
          "name": "measurement_id",
          "type": "text",
          "description": "Identifier of the measurement row.",
          "filterable": false,
          "reason": "identifier"
        },
        {
          "name": "patient_ref",
          "type": "text",
          "description": "NHS number of the patient.",
          "filterable": false,
          "reason": "identifier"
        },
        {
          "name": "visit_ref",
          "type": "text",
          "description": "Reference to clinic_visits.visit_id.",
          "filterable": false,
          "reason": "reference"
        },
        {
          "name": "measurement_date",
          "type": "text",
          "description": "Date the measurement was taken (ISO yyyy-mm-dd). Usually equals the visit date.",
          "filterable": true,
          "filter_type": "date",
          "range": {
            "min": "2026-04-22",
            "max": "2027-01-20"
          }
        },
        {
          "name": "measurement_type",
          "type": "text",
          "description": "Type of measurement: height, weight, hba1c, systolic_bp, diastolic_bp, acr (urinary albumin:creatinine), cholesterol.",
          "filterable": true,
          "filter_type": "category",
          "values": [
            "acr",
            "cholesterol",
            "diastolic_bp",
            "hba1c",
            "height",
            "systolic_bp",
            "weight"
          ]
        },
        {
          "name": "value",
          "type": "text",
          "description": "Numeric value of the measurement (recorded as text in this system because some HbA1c values use % units with one decimal place).",
          "filterable": true,
          "filter_type": "number",
          "range": {
            "min": 0.9,
            "max": 173.1
          }
        },
        {
          "name": "units",
          "type": "text",
          "description": "Units the value is recorded in. HbA1c may be recorded in either '%' or 'mmol/mol' depending on the source analyser at time of measurement \u2014 per NPDA rules values <20 are interpreted as % and values 20-195 as mmol/mol.",
          "filterable": true,
          "filter_type": "category",
          "values": [
            "%",
            "cm",
            "kg",
            "mg/mmol",
            "mmHg",
            "mmol/l",
            "mmol/mol"
          ]
        },
        {
          "name": "comment",
          "type": "text",
          "description": "Optional free-text comment on the measurement.",
          "filterable": false,
          "reason": "free-text"
        }
      ],
      "row_count": 82